{"v":1,"request_id":"hil-539991-1790440628528043641","ok":true,"result":{"site_id":"5173000000000044","network":"00000001524c0002","network_low32":"524c0002","site_epoch":1,"site_cert_serial":1,"sak_fingerprint":"60b8278f052b983748eb2d458588c821045618b6d94bbb9331857fac70c089ea","device_ca_id":"0dca000000000043","rs_epoch":1,"gk_epoch":2,"gk_staged":null,"gk":{"phase":"catching_up","cause":"manual","targets":3,"staged_ack":0,"active_ack":0,"unknown":3},"authority":{"attached":true,"channels":3},"member_cap":128,"members":3,"members_unconfirmed":0,"removed":0,"discovered":3,"join_requests":2,"live_exchanges":0,"channel":6,"channel_epoch":1,"gateways":["0000000000000001"],"membership_revision":3,"ledger_seq":3,"storage_durable":true,"policy":{"zero_touch_open":true,"decision_mode":"kguard","decision_timeout_ms":5000,"pending_retry_after_s":30},"counters":{"message_1":0,"message_1_refused":0,"busy_aborts":0,"unknown_relay":0,"timeouts":0,"relay_failed":0,"rejected_unverified":{},"allowed":0,"reissued":0,"pending":0,"denied":0,"removed_notices":0,"authority_busy":0,"store_failures":0,"gk_rejected":{}},"clock":"host_unix_ms","now_ms":1790440628528,"usb":{"configured":true,"attached":true,"join_relay":"ready"}}}
