{"v":1,"request_id":"hil-861230-1790353362780834325","ok":true,"result":{"site_id":"5173000000000042","network":"00000001524c0001","network_low32":"524c0001","site_epoch":1,"site_cert_serial":1,"sak_fingerprint":"565c49d06c9d2b338f8a33cb80d8ad00e7977dd3bb679aa09a4fc8c21634720c","device_ca_id":"0dca000000000001","rs_epoch":0,"gk_epoch":1,"gk_staged":null,"gk":{"phase":"stable","cause":null,"targets":0,"staged_ack":0,"active_ack":0,"unknown":0},"authority":{"attached":false,"channels":0},"member_cap":128,"members":0,"members_unconfirmed":0,"removed":0,"discovered":0,"join_requests":0,"live_exchanges":0,"channel":6,"channel_epoch":1,"gateways":["0000000000000001"],"membership_revision":0,"ledger_seq":0,"storage_durable":true,"policy":{"zero_touch_open":true,"decision_mode":"kguard","decision_timeout_ms":2000,"pending_retry_after_s":60},"counters":{"message_1":0,"message_1_refused":0,"busy_aborts":0,"unknown_relay":0,"timeouts":0,"relay_failed":0,"rejected_unverified":{},"allowed":0,"reissued":0,"pending":0,"denied":0,"removed_notices":0,"authority_busy":0,"store_failures":0,"gk_rejected":{}},"clock":"host_unix_ms","now_ms":1790353362780,"usb":{"configured":false,"attached":false,"join_relay":"not_ready"}}}
