{"v":1,"request_id":"hil-2264071-1790372139339122888","ok":true,"result":{"operation_id":"op-0000000000000008","kind":"cutover","phase":"preparing","expected_site_epoch":1,"new_site_epoch":2,"revision":1,"prepared":1,"applied":0,"unknown":1,"total":2,"waiting_gateway":false,"recovery_pending":false,"deadline_remaining_ms":438946,"commit_rs_epoch":0,"created_ms":1790371785325}}
