{"v":1,"request_id":"hil-2748805-1790444383727517889","ok":true,"result":{"members":[{"device_id":"0000000000000001","kid":"46de14bb5488cd85d51eee430580aaa0184d0029cfc946fc42c23932ddb9ab9a","state":"member","generation":1,"role":"gateway","member_cert_serial":4,"confirm_state":"active","delivered":true,"model":17,"hw_rev":2,"cert_serial":15,"approved_ms":1790441673874,"delivered_ms":1790441701402,"confirmed_ms":1790444373209,"last_seen_ms":1790444373358,"removed_ms":null,"removal_reason":null},{"device_id":"0000000000000002","kid":"7b3c96487a9953b0b38b1b2e92abfd0e1c8393dd74c713af550846348fdbd3ef","state":"member","generation":1,"role":"relay","member_cert_serial":5,"confirm_state":"allowed_unconfirmed","delivered":true,"model":17,"hw_rev":2,"cert_serial":16,"approved_ms":1790441769055,"delivered_ms":1790441769055,"confirmed_ms":null,"last_seen_ms":1790442433373,"removed_ms":null,"removal_reason":null},{"device_id":"0000000000000006","kid":"a6dd44a3e09a74e3a6354b50ab91ff1d26f1d3075620add8d8aecf66759cccf7","state":"member","generation":1,"role":"endpoint","member_cert_serial":6,"confirm_state":"allowed_unconfirmed","delivered":true,"model":17,"hw_rev":2,"cert_serial":14,"approved_ms":1790441787261,"delivered_ms":1790441787261,"confirmed_ms":null,"last_seen_ms":1790442633847,"removed_ms":null,"removal_reason":null}],"next_after":null,"clock":"host_unix_ms"}}
