{"v":1,"request_id":"hil-1566216-1790361878276285818","ok":true,"result":{"members":[{"device_id":"0000000000000001","kid":"3a7d8197c53cce2bd4e0aac77b23d8b52e65c359c1adc3752131fcb0863ba3a1","state":"member","generation":1,"role":"gateway","member_cert_serial":1,"confirm_state":"active","delivered":true,"model":17,"hw_rev":2,"cert_serial":2,"approved_ms":1790357883101,"delivered_ms":1790357926362,"confirmed_ms":1790358207080,"last_seen_ms":1790361713824,"removed_ms":null,"removal_reason":null},{"device_id":"0000000000000002","kid":"ae389d3a0b85d5c597a214a928621abf71a9b46d802ad9219f7af5bee9771534","state":"member","generation":1,"role":"relay","member_cert_serial":2,"confirm_state":"allowed_unconfirmed","delivered":true,"model":17,"hw_rev":2,"cert_serial":1,"approved_ms":1790360171707,"delivered_ms":1790360171707,"confirmed_ms":null,"last_seen_ms":1790360171707,"removed_ms":null,"removal_reason":null}],"next_after":null,"clock":"host_unix_ms"}}
