{"v":1,"request_id":"ctl-650920","ok":true,"result":{"source":{"state":"unsupported","gateway":"0000000000000001","session_id":6770791725793642894,"synced_ms":null,"tracked":1,"evicted":0,"clock":"host_unix_ms"},"nodes":[{"node":"0000000000000001","role":"gateway","connected":true,"listed":true,"neighbor":false,"direct":true,"hops":0,"next_hop":null,"route_metric":null,"link_cost":null,"rssi_dbm":null,"rssi_avg_dbm":null,"telemetry_stale":false,"last_heard_ms":null,"heard_age_ms":null,"updated_ms":1790401980774,"changed_ms":1790401980774}],"next_after":null}}
