{"v":1,"request_id":"hil-2748807-1790444383749165387","ok":true,"result":{"operation_id":"op-0000000000000005","kind":"cutover","phase":"recovery_pending","expected_site_epoch":1,"new_site_epoch":2,"revision":1,"prepared":2,"applied":1,"unknown":0,"total":3,"waiting_gateway":false,"recovery_pending":true,"deadline_remaining_ms":null,"commit_rs_epoch":2,"created_ms":1790442079529}}
