{"v":1,"request_id":"ctl-1253943","ok":true,"result":{"group_op":"grpdc1fcc3700000001","network":"00000000524c0003","group":65535,"all":true,"state":"WAITING_FOR_END_RECEIPT","final":false,"result":"OK","reason":"GROUP_ROUND_PENDING","message":{"session":"961fb76b","sequence":"8000000000000001"},"gateway":"0000000000000001","rounds":0,"delivered":0,"nonmember":0,"missing_total":0,"unaccounted":0,"missing":[],"missing_truncated":false,"priority":"NORMAL","ordered":false,"ttl_ms":5000,"hop_limit":10,"payload_len":8,"submitted_ms":1790441885004,"admitted_ms":1790441885012,"settled_ms":null,"clock":"host_unix_ms"}}
