{"v":1,"request_id":"ctl-3236675","ok":true,"result":{"source":{"state":"live","gateway":"0000000000000001","session_id":9869496386473767482,"synced_ms":1790452624121,"tracked":1,"evicted":0,"clock":"host_unix_ms"},"nodes":[{"node":"0000000000000001","role":"gateway","connected":true,"listed":true,"neighbor":false,"direct":true,"hops":0,"next_hop":null,"route_metric":null,"link_cost":null,"rssi_dbm":null,"rssi_avg_dbm":null,"telemetry_stale":false,"last_heard_ms":null,"heard_age_ms":null,"updated_ms":1790452583111,"changed_ms":1790452583111}],"next_after":null}}
