{"v":1,"request_id":"hil-351282-1790440328686374387","ok":true,"result":{"members":[{"device_id":"0000000000000001","kid":"06a77e4ae52c1c65a54906872340769fe9662acbc97123bb7af898dd3e4972d0","state":"member","generation":1,"role":"gateway","member_cert_serial":1,"confirm_state":"active","delivered":true,"model":17,"hw_rev":2,"cert_serial":11,"approved_ms":1790438587965,"delivered_ms":1790438616834,"confirmed_ms":1790438617457,"last_seen_ms":1790440321683,"removed_ms":null,"removal_reason":null},{"device_id":"0000000000000002","kid":"eeb4293509ca0fc5d6c990f519c3ce61133363785f2a85d7577af5e189c4513c","state":"member","generation":1,"role":"relay","member_cert_serial":2,"confirm_state":"active","delivered":true,"model":17,"hw_rev":2,"cert_serial":12,"approved_ms":1790439875792,"delivered_ms":1790439875792,"confirmed_ms":1790439936904,"last_seen_ms":1790439936924,"removed_ms":null,"removal_reason":null},{"device_id":"0000000000000003","kid":"7450ffdd882570746b6214b232b2a682438db0b1cf06bffb02c8cb55937bd883","state":"member","generation":1,"role":"endpoint","member_cert_serial":3,"confirm_state":"active","delivered":true,"model":17,"hw_rev":2,"cert_serial":13,"approved_ms":1790439879808,"delivered_ms":1790439887970,"confirmed_ms":1790439914685,"last_seen_ms":1790439914710,"removed_ms":null,"removal_reason":null}],"next_after":null,"clock":"host_unix_ms"}}
