{"v":1,"request_id":"ctl-442996","ok":true,"result":{"members":[{"device_id":"0000000000000001","kid":"013ce125915caedff6b2ef66a8b2cd9319ae5ae16b87aa933079866f613ae589","state":"member","generation":1,"role":"gateway","member_cert_serial":1,"confirm_state":"active","delivered":true,"model":1,"hw_rev":1,"cert_serial":173038069,"approved_ms":1790661403503,"delivered_ms":1790661403503,"confirmed_ms":1790661405188,"last_seen_ms":1790662217771,"removed_ms":null,"removal_reason":null},{"device_id":"0000000000000002","kid":"edb66fdb8cebf1e68c5598a7cd5c653ce51c5bc9f8e481c175e9404e1b927ed2","state":"member","generation":1,"role":"relay","member_cert_serial":3,"confirm_state":"active","delivered":true,"model":1,"hw_rev":1,"cert_serial":102,"approved_ms":1790661469967,"delivered_ms":1790661543470,"confirmed_ms":1790662258004,"last_seen_ms":1790662258185,"removed_ms":null,"removal_reason":null},{"device_id":"0000000000000003","kid":"1aecf50aaaa10846dc12acdce69a177e035ee387cc72342597bb4f9f1f6aef45","state":"member","generation":1,"role":"endpoint","member_cert_serial":2,"confirm_state":"active","delivered":true,"model":1,"hw_rev":1,"cert_serial":103,"approved_ms":1790661415363,"delivered_ms":1790662535357,"confirmed_ms":1790661428088,"last_seen_ms":1790662535357,"removed_ms":null,"removal_reason":null}],"next_after":null,"clock":"host_unix_ms"}}
